{
  "artifact_type": "redaction_policy",
  "disclosure": {
    "checks": [],
    "coverage": {
      "credentials": "not_checked",
      "private_paths": "not_checked",
      "raw_output": "not_checked"
    },
    "policy": "",
    "publication_authorized": false,
    "status": "operator_asserted"
  },
  "mode": "public_safe_fixture_redaction",
  "non_claims": [
    "does_not_claim_complete_secret_detection",
    "does_not_prove_upstream_data_never_contained_secrets",
    "does_not_authorize_publication"
  ],
  "policy_id": "sclite-public-safe-v0.1",
  "public_safety": {
    "credentials_included": "unknown",
    "live_target_execution": false,
    "private_paths_included": "unknown",
    "raw_live_evidence_included": false,
    "raw_stdout_stderr_included": false
  },
  "rules": [
    {
      "action": "replace_value",
      "applies_to": [
        "api_key",
        "apikey",
        "auth",
        "authorization",
        "cookie",
        "cookies",
        "password",
        "password_ref",
        "secret",
        "token"
      ],
      "description": "Redact values for common secret-bearing keys such as token, secret, authorization, cookie, and password.",
      "replacement": "<redacted>",
      "rule_id": "sensitive_value_keys"
    },
    {
      "action": "omit_or_replace",
      "applies_to": [
        "stdout",
        "stderr"
      ],
      "description": "Omit raw stdout/stderr content from public artifacts.",
      "replacement": "<omitted_for_public_demo>",
      "rule_id": "raw_stdout_stderr"
    },
    {
      "action": "replace_local_path",
      "applies_to": [
        "string_values"
      ],
      "description": "Replace local home/workspace paths with a public-safe placeholder.",
      "replacement": "<local_path_omitted>",
      "rule_id": "local_paths"
    },
    {
      "action": "replace_header_value",
      "applies_to": [
        "string_values"
      ],
      "description": "Redact header-like strings containing authorization, cookie, token, secret, or api-key markers.",
      "replacement": "<redacted>",
      "rule_id": "header_like_secrets"
    }
  ],
  "schema_version": "v0.2"
}
